[
 {
  "uberon_id": "UBERON:0003890",
  "uberon_label": "Mullerian duct",
  "taxon_id": "NCBITaxon:9606",
  "stage_id": "HsapDv:0000023",
  "stage_label": "Carnegie stage 16",
  "claim": "start",
  "quote": "The primordium of the paramesonephric duct is beginning to appear as an invagination of thickened coelomic epithelium over the mesonephros.",
  "source_id": "ORahilly1987:stage16",
  "section": "Urinary and Reproductive Systems",
  "source_url": "https://embryology.med.unsw.edu.au/embryology/index.php?title=1987_Developmental_Stages_In_Human_Embryos_-_Stage_16",
  "source_tier": "primary",
  "hedged": false,
  "evidence_code": "ECO:0000304",
  "note": "Supports moving the start bound from CS15 to CS16. CS17 adds that the ducts 'may appear at the previous stage', i.e. CS16, so CS16 is the earliest the source will name.",
  "curator": "agent:stage-evidence",
  "date": "2026-10-10"
 },
 {
  "uberon_id": "UBERON:0005061",
  "uberon_label": "neural groove",
  "taxon_id": "NCBITaxon:9606",
  "stage_id": "HsapDv:0000014",
  "stage_label": "Carnegie stage 08",
  "claim": "start",
  "quote": "The most advanced embryos with regard to endodermal spread are also more advanced in other respects. (Nos. 5960 and 7545 already show a neural groove.) It may be that this endoderm is derived from the caudal part of the primitive streak (fig. 6-2).",
  "source_id": "ORahilly1987:stage8",
  "section": "Histological Features",
  "source_url": "https://embryology.med.unsw.edu.au/embryology/index.php?title=1987_Developmental_Stages_In_Human_Embryos_-_Stage_8",
  "source_tier": "primary",
  "hedged": false,
  "evidence_code": "ECO:0000304",
  "note": "Supports moving the start bound from CS9 to CS8: two stage-8 specimens already show a neural groove. The CS9 summary then treats the groove as established ('Now that the neural groove and the first somites are present').",
  "curator": "agent:stage-evidence",
  "date": "2026-10-10"
 },
 {
  "uberon_id": "UBERON:0004061",
  "uberon_label": "neural tube mantle layer",
  "taxon_id": "NCBITaxon:9606",
  "stage_id": "HsapDv:0000020",
  "stage_label": "Carnegie stage 13",
  "claim": "start",
  "quote": "The remaining wall is made up of the undifferentiated ependymal zone, except for a beginning mantle zone in the region that is to form the ventral horn of gray matter.",
  "source_id": "ORahilly1987:stage13",
  "section": "Nervous System",
  "source_url": "https://embryology.med.unsw.edu.au/embryology/index.php?title=1987_Developmental_Stages_In_Human_Embryos_-_Stage_13",
  "source_tier": "primary",
  "hedged": false,
  "evidence_code": "ECO:0000304",
  "note": "Supports moving the start bound from CS14 to CS13: a beginning mantle zone is described at CS13, and at CS11 the source says one cannot yet mark off ependymal and mantle zones.",
  "curator": "agent:stage-evidence",
  "date": "2026-10-10"
 },
 {
  "uberon_id": "UBERON:0004062",
  "uberon_label": "neural tube marginal layer",
  "taxon_id": "NCBITaxon:9606",
  "stage_id": "HsapDv:0000019",
  "stage_label": "Carnegie stage 12",
  "claim": "start",
  "quote": "Neurofibrils begin to form for the first time in the rhombencephalic wall, and in most embryos a marginal layer begins to develop.",
  "source_id": "ORahilly1987:stage12",
  "section": "Nervous System",
  "source_url": "https://embryology.med.unsw.edu.au/embryology/index.php?title=1987_Developmental_Stages_In_Human_Embryos_-_Stage_12",
  "source_tier": "primary",
  "hedged": false,
  "evidence_code": "ECO:0000304",
  "note": "Supports moving the start bound from CS15 to CS12, a three-stage correction. This is the source's first statement that a marginal layer develops.",
  "curator": "agent:stage-evidence",
  "date": "2026-10-10"
 },
 {
  "uberon_id": "UBERON:0004060",
  "uberon_label": "neural tube ventricular layer",
  "taxon_id": "NCBITaxon:9606",
  "stage_id": "HsapDv:0000020",
  "stage_label": "Carnegie stage 13",
  "claim": "start",
  "quote": "The remaining wall is made up of the undifferentiated ependymal zone, except for a beginning mantle zone in the region that is to form the ventral horn of gray matter.",
  "source_id": "ORahilly1987:stage13",
  "section": "Nervous System",
  "source_url": "https://embryology.med.unsw.edu.au/embryology/index.php?title=1987_Developmental_Stages_In_Human_Embryos_-_Stage_13",
  "source_tier": "primary",
  "hedged": false,
  "evidence_code": "ECO:0000304",
  "note": "Supports moving the start bound from CS12 to CS13. At CS11 the source says 'one cannot yet mark off ependymal and mantle' zones; this CS13 sentence names the ependymal zone. O'Rahilly writes ependymal where Uberon says ventricular layer.",
  "curator": "agent:stage-evidence",
  "date": "2026-10-10"
 },
 {
  "uberon_id": "UBERON:0006267",
  "uberon_label": "notochordal plate",
  "taxon_id": "NCBITaxon:9606",
  "stage_id": "HsapDv:0000017",
  "stage_label": "Carnegie stage 10",
  "claim": "present",
  "quote": "Although frequently referred to as the notochord, the axial cells caudal to the prechordal plate are still merely notochordal plate at this stage.",
  "source_id": "ORahilly1987:stage10",
  "section": "Notochordal plate",
  "source_url": "https://embryology.med.unsw.edu.au/embryology/index.php?title=1987_Developmental_Stages_In_Human_Embryos_-_Stage_10",
  "source_tier": "primary",
  "hedged": false,
  "evidence_code": "ECO:0000304",
  "note": "Supports moving the END bound from CS9 to CS11. The table had the notochordal plate gone by CS9, but the source still calls the axial cells 'merely notochordal plate' at CS10 and heads a CS11 section 'Notochordal plate and notochord'.",
  "curator": "agent:stage-evidence",
  "date": "2026-10-10"
 },
 {
  "uberon_id": "UBERON:0005870",
  "uberon_label": "olfactory pit",
  "taxon_id": "NCBITaxon:9606",
  "stage_id": "HsapDv:0000022",
  "stage_label": "Carnegie stage 15",
  "claim": "start",
  "quote": "External: lens vesicles are closed; nasal pits are appearing; hand plates are forming.",
  "source_id": "ORahilly1987:stage15",
  "section": "Summary",
  "source_url": "https://embryology.med.unsw.edu.au/embryology/index.php?title=1987_Developmental_Stages_In_Human_Embryos_-_Stage_15",
  "source_tier": "primary",
  "hedged": false,
  "evidence_code": "ECO:0000304",
  "note": "Supports moving the start bound from CS14 to CS15: the CS15 summary is where nasal pits first appear. At CS14 the source says the nasal plate 'is usually flat ... although it has not yet acquired a distinct lip'.",
  "curator": "agent:stage-evidence",
  "date": "2026-10-10"
 },
 {
  "uberon_id": "UBERON:0003050",
  "uberon_label": "olfactory placode",
  "taxon_id": "NCBITaxon:9606",
  "stage_id": "HsapDv:0000019",
  "stage_label": "Carnegie stage 12",
  "claim": "start",
  "quote": "The nasal discs become thicker and form a portion of the ectodermal ring on both sides of the closed neuropore (O'Rahilly and M\u00fcller, 1985).",
  "source_id": "ORahilly1987:stage12",
  "section": "Nervous System",
  "source_url": "https://embryology.med.unsw.edu.au/embryology/index.php?title=1987_Developmental_Stages_In_Human_Embryos_-_Stage_12",
  "source_tier": "primary",
  "hedged": false,
  "evidence_code": "ECO:0000304",
  "note": "Supports moving the start bound from CS13 to CS12. Reachable only via SYNONYMS.tsv: the source states 'the term placode is avoided' and writes nasal disc or nasal plate throughout.",
  "curator": "agent:stage-evidence",
  "date": "2026-10-10"
 }
]