[
 {
  "uberon_id": "UBERON:0004341",
  "uberon_label": "primitive streak",
  "taxon_id": "NCBITaxon:9606",
  "stage_id": "HsapDv:0000011",
  "stage_label": "Carnegie stage 06",
  "claim": "start",
  "quote": "In the human, the primitive streak appears first during stage 6.",
  "source_id": "ORahilly1987:stage6",
  "section": "Histological Features",
  "source_url": "https://embryology.med.unsw.edu.au/embryology/index.php?title=1987_Developmental_Stages_In_Human_Embryos_-_Stage_6",
  "source_tier": "primary",
  "hedged": false,
  "evidence_code": "ECO:0000304",
  "note": "Confirms the table's CS6 start bound in the source's own words, and the sentence is explicitly scoped to human, which matters in a chapter that otherwise draws heavily on chick. The source localises it further to stage 6b: 'unequivocal manifestation awaits the initial appearance of the primitive streak during stage 6b'.",
  "curator": "do12",
  "date": "2026-10-09"
 },
 {
  "uberon_id": "UBERON:0004341",
  "uberon_label": "primitive streak",
  "taxon_id": "NCBITaxon:9606",
  "stage_id": "HsapDv:0000018",
  "stage_label": "Carnegie stage 11",
  "claim": "absent",
  "quote": "The caudal eminence, which lies between the cloacal membrane and the site of the neurenteric canal, represents the region of the former primitive streak.",
  "source_id": "ORahilly1987:stage11",
  "section": "Histological Features",
  "source_url": "https://embryology.med.unsw.edu.au/embryology/index.php?title=1987_Developmental_Stages_In_Human_Embryos_-_Stage_11",
  "source_tier": "primary",
  "hedged": false,
  "evidence_code": "ECO:0000304",
  "note": "Supports the table's CS10 end bound by bracketing it from the far side: 'former' at CS11, while at CS10 the source still describes the streak as present ('In stage 10 the primitive streak is limited to the caudal part of the body'). Ending during CS10 is exactly right. This also overturns a doubt raised earlier from Wikipedia, which put disappearance at about day 26 and so nearer CS12; the tertiary source was wrong and the table was right.",
  "curator": "do12",
  "date": "2026-10-09"
 },
 {
  "uberon_id": "UBERON:0003069",
  "uberon_label": "otic placode",
  "taxon_id": "NCBITaxon:9606",
  "stage_id": "HsapDv:0000016",
  "stage_label": "Carnegie stage 09",
  "claim": "start",
  "quote": "The otic disc (or plate) makes its appearance during stage 9 (fig. 9-6).",
  "source_id": "ORahilly1987:stage9",
  "section": "Ear",
  "source_url": "https://embryology.med.unsw.edu.au/embryology/index.php?title=1987_Developmental_Stages_In_Human_Embryos_-_Stage_9",
  "source_tier": "primary",
  "hedged": false,
  "evidence_code": "ECO:0000304",
  "note": "Confirms the table's CS9 start, unhedged and in the source's own words. Reachable only through SYNONYMS.tsv: the book states that 'the term placode is avoided' and writes otic disc throughout, so a search on the Uberon label alone returns nothing and looks like silence.",
  "curator": "do12",
  "date": "2026-10-09"
 },
 {
  "uberon_id": "UBERON:0004161",
  "uberon_label": "septum transversum",
  "taxon_id": "NCBITaxon:9606",
  "stage_id": "HsapDv:0000016",
  "stage_label": "Carnegie stage 09",
  "claim": "start",
  "quote": "Other features that have been identified by stage 9 include the \"cardiac jelly\" (Davis, 1927), the mesocardium, and the septum transversum (Ingalls, 1920).",
  "source_id": "ORahilly1987:stage9",
  "section": "Heart",
  "source_url": "https://embryology.med.unsw.edu.au/embryology/index.php?title=1987_Developmental_Stages_In_Human_Embryos_-_Stage_9",
  "source_tier": "primary",
  "hedged": false,
  "evidence_code": "ECO:0000304",
  "note": "Confirms the table's CS9 start. Note 'identified by stage 9' is a statement about when it has been observed, not strictly about onset, so this bounds existence at or before CS9 rather than pinning it to CS9. Wikipedia put the septum transversum at day 22, which is CS10 and a stage later; the primary source agrees with the table.",
  "curator": "do12",
  "date": "2026-10-09"
 },
 {
  "uberon_id": "UBERON:0003073",
  "uberon_label": "lens placode",
  "taxon_id": "NCBITaxon:9606",
  "stage_id": "HsapDv:0000020",
  "stage_label": "Carnegie stage 13",
  "claim": "present",
  "quote": "Internal: septum primum and foramen primum appear in the heart; right and left lung buds are recognizable, and the trachea begins its development; retinal and lens discs appear; the endolymphatic appendage becomes distinguishable by the end of the stage.",
  "source_id": "ORahilly1987:stage13",
  "section": "Summary",
  "source_url": "https://embryology.med.unsw.edu.au/embryology/index.php?title=1987_Developmental_Stages_In_Human_Embryos_-_Stage_13",
  "source_tier": "primary",
  "hedged": false,
  "evidence_code": "ECO:0000304",
  "note": "Unresolved, and recorded as `present` rather than `start` for that reason. The table has the lens placode starting CS12 and ending CS13. This CS13 stage summary says the lens disc *appears* at CS13, which would put the onset a stage later; but the CS12 account lists 'nasal and lens discs' among the six parts of the ectodermal ring that is 'complete at stage 12'. The source is not self-consistent here and a curator should read both passages before moving the bound. Do not shift CS12 on the strength of this quote alone.",
  "curator": "do12",
  "date": "2026-10-09"
 }
]
