[
 {
  "uberon_id": "UBERON:0002063",
  "uberon_label": "sinus venosus",
  "taxon_id": "NCBITaxon:9606",
  "stage_id": "HsapDv:0000017",
  "stage_label": "Carnegie stage 10",
  "claim": "absent",
  "quote": "Although a sinus venosus as such is not present until the next stage, left and right sinusal horns appear during stage 10.",
  "source_id": "ORahilly1987:stage10",
  "section": "Heart",
  "source_url": "https://embryology.med.unsw.edu.au/embryology/index.php?title=1987_Developmental_Stages_In_Human_Embryos_-_Stage_10",
  "source_tier": "primary",
  "hedged": false,
  "evidence_code": "ECO:0000304",
  "note": "Contradicts the table's CS10 start in the source's own words, and unusually explicitly: the sinus venosus is 'not present until the next stage'. What stage 10 has is the sinusal horns. The CS11 summary then lists 'the sinus venosus develops'. Move the start bound to CS11.",
  "curator": "do12",
  "date": "2026-10-09"
 },
 {
  "uberon_id": "UBERON:0004155",
  "uberon_label": "atrial septum secundum",
  "taxon_id": "NCBITaxon:9606",
  "stage_id": "HsapDv:0000025",
  "stage_label": "Carnegie stage 18",
  "claim": "start",
  "quote": "Internal: in the heart, septum secundum and the associated foramen ovale are appearing; the membranous part of the interventricular septum is beginning to take form; the vomeronasal organ is represented by a groove; choanae develop; some subsegmental buds develop in the bronchial tree; collecting tubules develop from the calices; testicular cords may begin to appear in the male gonad; the paramesonephric duct grows rapidly down through the mesonephros; 1-3 semicircular ducts are present in the internal ear.",
  "source_id": "ORahilly1987:stage18",
  "section": "Summary",
  "source_url": "https://embryology.med.unsw.edu.au/embryology/index.php?title=1987_Developmental_Stages_In_Human_Embryos_-_Stage_18",
  "source_tier": "primary",
  "hedged": false,
  "evidence_code": "ECO:0000304",
  "note": "The table starts septum secundum at CS16. This is the source's first mention of it and it is at CS18, two stages later, in the stage summary. Nothing at CS16 or CS17 refers to it.",
  "curator": "do12",
  "date": "2026-10-09"
 },
 {
  "uberon_id": "UBERON:0004754",
  "uberon_label": "foramen ovale of heart",
  "taxon_id": "NCBITaxon:9606",
  "stage_id": "HsapDv:0000025",
  "stage_label": "Carnegie stage 18",
  "claim": "start",
  "quote": "Internal: in the heart, septum secundum and the associated foramen ovale are appearing; the membranous part of the interventricular septum is beginning to take form; the vomeronasal organ is represented by a groove; choanae develop; some subsegmental buds develop in the bronchial tree; collecting tubules develop from the calices; testicular cords may begin to appear in the male gonad; the paramesonephric duct grows rapidly down through the mesonephros; 1-3 semicircular ducts are present in the internal ear.",
  "source_id": "ORahilly1987:stage18",
  "section": "Summary",
  "source_url": "https://embryology.med.unsw.edu.au/embryology/index.php?title=1987_Developmental_Stages_In_Human_Embryos_-_Stage_18",
  "source_tier": "primary",
  "hedged": false,
  "evidence_code": "ECO:0000304",
  "note": "Same sentence, same problem: the table starts the foramen ovale at CS16 and the source first has it 'appearing' at CS18, alongside septum secundum. The two bounds should move together.",
  "curator": "do12",
  "date": "2026-10-09"
 },
 {
  "uberon_id": "UBERON:0004154",
  "uberon_label": "atrial septum primum",
  "taxon_id": "NCBITaxon:9606",
  "stage_id": "HsapDv:0000020",
  "stage_label": "Carnegie stage 13",
  "claim": "start",
  "quote": "Internal: septum primum and foramen primum appear in the heart; right and left lung buds are recognizable, and the trachea begins its development; retinal and lens discs appear; the endolymphatic appendage becomes distinguishable by the end of the stage.",
  "source_id": "ORahilly1987:stage13",
  "section": "Summary",
  "source_url": "https://embryology.med.unsw.edu.au/embryology/index.php?title=1987_Developmental_Stages_In_Human_Embryos_-_Stage_13",
  "source_tier": "primary",
  "hedged": false,
  "evidence_code": "ECO:0000304",
  "note": "The table starts septum primum at CS14. The source has it appearing at CS13, unhedged, in the stage summary -- and at CS12 says it 'may appear'. The bound is a stage late, arguably two.",
  "curator": "do12",
  "date": "2026-10-09"
 },
 {
  "uberon_id": "UBERON:0006215",
  "uberon_label": "rhombic lip",
  "taxon_id": "NCBITaxon:9606",
  "stage_id": "HsapDv:0000023",
  "stage_label": "Carnegie stage 16",
  "claim": "start",
  "quote": "The alar lamina is developing, and its upper part, the rhombic lip, is very dense.",
  "source_id": "ORahilly1987:stage16",
  "section": "Nervous System",
  "source_url": "https://embryology.med.unsw.edu.au/embryology/index.php?title=1987_Developmental_Stages_In_Human_Embryos_-_Stage_16",
  "source_tier": "primary",
  "hedged": false,
  "evidence_code": "ECO:0000304",
  "note": "The table starts the rhombic lip at CS14. This is the source's only mention of it and it is at CS16. Two stages early, and nothing at CS14 or CS15 supports the earlier bound.",
  "curator": "do12",
  "date": "2026-10-09"
 },
 {
  "uberon_id": "UBERON:0004008",
  "uberon_label": "cerebellar plate",
  "taxon_id": "NCBITaxon:9606",
  "stage_id": "HsapDv:0000024",
  "stage_label": "Carnegie stage 17",
  "claim": "present",
  "quote": "The cerebellar plate (innerer Kleinhirnwulst of Hochsetter) is present as a clear thickening.",
  "source_id": "ORahilly1987:stage17",
  "section": "Nervous System",
  "source_url": "https://embryology.med.unsw.edu.au/embryology/index.php?title=1987_Developmental_Stages_In_Human_Embryos_-_Stage_17",
  "source_tier": "primary",
  "hedged": false,
  "evidence_code": "ECO:0000304",
  "note": "Cuts against the table's CS16 start from both directions and does not settle it. The CS14 summary says 'future cerebral hemispheres and cerebellar plates begin to be visible', which is earlier than CS16; this CS17 sentence is the first to call it present as a clear thickening, which is later. CS16 is not what the source says at either end. Recorded as `present` because neither passage is an onset statement.",
  "curator": "do12",
  "date": "2026-10-09"
 },
 {
  "uberon_id": "UBERON:0001049",
  "uberon_label": "neural tube",
  "taxon_id": "NCBITaxon:9606",
  "stage_id": "HsapDv:0000017",
  "stage_label": "Carnegie stage 10",
  "claim": "start",
  "quote": "Although a sinus venosus as such is not present until the next stage, left and right sinusal horns appear during stage 10.",
  "source_id": "ORahilly1987:stage10",
  "section": "Heart",
  "source_url": "https://embryology.med.unsw.edu.au/embryology/index.php?title=1987_Developmental_Stages_In_Human_Embryos_-_Stage_10",
  "source_tier": "primary",
  "hedged": false,
  "evidence_code": "ECO:0000304",
  "note": "Confirms the table's CS10 start about as directly as this source ever does: the neural tube 'first begins to be formed' during stage 10.",
  "curator": "do12",
  "date": "2026-10-09"
 }
]